{"schema_version":1,"figure_id":"fig1","purpose":"Synthetic example: sensor to processor","main_sections":["System architecture"],"parts":[{"id":"sensor","number":"101","label":"Sensor"},{"id":"processor","number":"102","label":"Processor"}],"connections":[{"from":"sensor","to":"processor","label":"measurement"}],"required_features":["Sensor sends measurement to processor"],"forbidden_structures":["No unmentioned radio or cloud service"],"layout_constraints":["Left-to-right data flow"],"language":"en","backend":"svg","formats":["svg"],"review_criteria":["Part numbers and direction agree with MAIN"],"optional":false}
